{
  "run_id": "08946df4-5f14-4fc5-87eb-1dbabbf35f70",
  "template": "A-story-captions",
  "mode": "engine",
  "git_sha": "a6bb6b5d72475e8a359cac1d19084ac3d04070e5",
  "filmcraft_version": "filmcraft-cli 0.7.2",
  "build_profile": "release+lto",
  "env": {
    "os": "macos",
    "kernel": "25.6.0",
    "cpu_model": "Apple M1",
    "cores": 8,
    "ram_gb": 8.0,
    "gpu": {
      "model": "Apple M1 Integrated GPU",
      "driver": "Metal / Apple Silicon",
      "cuda": null
    },
    "power_source": "ac",
    "instance_type": "local"
  },
  "output": {
    "path": "/var/folders/r_/5spkzt010d9557v1nm7j3pr00000gn/T/cutline_bench_08946df4-5f14-4fc5-87eb-1dbabbf35f70/output.mp4",
    "duration_s": 60.01,
    "width": 1080,
    "height": 1920,
    "fps": 30.0,
    "frames": 1800,
    "codec": "h264",
    "encoder": "filmcraft 0.7.2",
    "hw_encode": null,
    "size_bytes": 82897472,
    "frame_hashes_sha256": "9380acbdc58bf082b770c0dc1c3e4ae8446bbd1c4b249e56592d4cfd0d7abef2"
  },
  "timing": {
    "wall_total_s": 80.6,
    "render_wall_s": 80.6,
    "realtime_multiple": 0.74,
    "stages": {
      "fetch_s": 0.0,
      "align_s": 0.0,
      "composite_encode_s": 80.6,
      "mux_s": 0.0
    }
  },
  "frame_time_ms": {
    "p50": null,
    "p95": null,
    "p99": null,
    "source": "unavailable"
  },
  "memory": {
    "peak_rss_tree_mb": 7.28,
    "peak_cgroup_mb": null,
    "method": "libproc_taskinfo_recursive"
  },
  "cpu": {
    "avg_util_pct": 0.4,
    "peak_util_pct": 1.3
  },
  "gpu_util": {
    "avg_pct": null,
    "peak_pct": null,
    "encoder_avg_pct": null,
    "decoder_avg_pct": null,
    "vram_peak_mb": null
  },
  "aligner": "rule_based",
  "validity": {
    "ffprobe_ok": true,
    "duration_ok": true,
    "errors": []
  }
}